PARTICIPANT,SCENT,DESCRIPTOIN NO.,TEXT,SOURCE,POSITIVE,NEGATIVE,STRONG,WEAK,ABSTRACT,FAMILIAR,UNFAMILIAR,EFFECT,COMPOSITION
18,Vetiver,3326,smells like a chemical i shouldnt be smelling,1,0,0,0,0,0,0,0,0,0
18,Vetiver,3327,synthetic,0,0,0,0,0,0,0,0,0,1
18,Caraway Seed,3328,synthetic,0,0,0,0,0,0,0,0,0,1
18,Musk,3329,soapy,1,0,0,0,0,0,0,0,0,0
18,Cedramber,3330,winter,1,0,0,0,0,0,0,0,0,0
18,Cedramber,3331,i bet you've never had someone so expressive as this,0,0,0,0,0,0,0,0,0,0
18,Cedramber,3332,so intune with my innovations,0,0,0,0,0,0,0,0,0,0
18,Geranium,3333,i wanna say a circular object that grows on trees,1,0,0,0,0,0,0,0,0,0
18,Geranium,3334,thats what im thinking,0,0,0,0,0,0,0,0,0,0
18,Geranium,3335,thats what im imaginging in my head,0,0,0,0,0,0,0,0,0,0
18,Geranium,3336,the word i wanna use is i actually dont know what you call an object thats round on all sides but not exactly a circle,1,0,0,0,0,0,0,0,0,0
18,Geranium,3337,it smells really similar to one i smelt before,1,0,0,0,0,0,0,0,0,0
18,Geranium,3338,because it gives me that little ctirus scent,1,0,0,0,0,0,0,0,0,0
18,Geranium,3339,but its not really strong,0,0,0,0,1,0,0,0,0,0
18,Geranium,3340,its like when you find a lemon thats fallen on the ground from a tree,1,0,0,0,0,0,0,0,0,0
18,Geranium,3341,and itss been there for like a minute and it still kinda smells like a lemon but doesnt really,1,0,0,0,0,0,0,0,0,0
18,Geranium,3342,thats like exactly what im feeling,0,0,0,0,0,0,0,0,0,0
18,Sea Minerals,3343,it just smells like regular cologne,1,0,0,0,0,0,0,0,0,0
18,Labdanum,3344,i dont know,0,0,0,0,0,0,0,0,0,0
18,Labdanum,3345,its so familiar but i cant,0,0,0,0,0,0,1,0,0,0
18,Labdanum,3346,i don tknow im gonna say the leather interior of a car,1,0,0,0,0,0,0,0,0,0
18,Mint,3347,oh,0,0,0,0,0,0,0,0,0,0
18,Mint,3348,gum like its not a sharp mint its a gum,2,0,0,0,0,1,0,0,0,0
18,Mint,3349,spearmint gum,1,0,0,0,0,0,0,0,0,0
18,Mint,3350,"i dont actually know the difference, whatveer the green one is",1,0,0,0,0,0,0,0,0,0
18,Mint,3351,not the blue one,1,0,0,0,0,0,0,0,0,0
18,Grapefruit,3352,okay,0,0,0,0,0,0,0,0,0,0
18,Grapefruit,3353,you know what it smells like?,0,0,0,0,0,0,0,0,0,0
18,Grapefruit,3354,"its the when you you know that little orange, oh my god",1,0,0,0,0,0,0,0,0,0
18,Grapefruit,3355,orange vitamin candies,1,0,0,0,0,0,0,0,0,0
18,Grapefruit,3356,thats exactly what it smells like,0,0,0,0,0,0,0,0,0,0
18,Grapefruit,3357,i was trying to think whats the little one that disolves in your mouth,0,0,0,0,0,0,0,0,0,0
18,White Tea,3358,ah cool breeze,1,0,0,0,0,1,0,0,0,0
18,Geosmin,3359,stale air,1,0,0,0,0,1,0,0,0,0
18,Geosmin,3360,because i can barely smell it but theres a tinge of something,0,0,0,0,1,0,0,0,0,0
18,Geosmin,3361,"perfect, perfect description",0,0,0,0,0,0,0,0,0,0
18,Wattle,3362,this is definitely candy like,1,0,0,0,0,0,0,0,0,0
18,Wattle,3363,fruity candy is what ill say,2,0,0,0,0,0,0,0,0,0
18,Chamomile,3364,like an open meadow,1,0,0,0,0,0,0,0,0,0
18,Honeysuckle,3365,ocean,1,0,0,0,0,0,0,0,0,0
18,Honeysuckle,3366,ocean,1,0,0,0,0,0,0,0,0,0
18,Honeysuckle,3367,have i used ocean,0,0,0,0,0,0,0,0,0,0
18,Honeysuckle,3368,but not a sea salty ocean,1,0,0,0,0,0,0,0,0,0
18,Honeysuckle,3369,maybe larger body of water is what im going for,1,0,0,0,0,1,0,0,0,0
18,Rosewood,3370,toxic gas,1,0,1,0,0,0,0,0,0,0
18,Rosewood,3371,the only way i can think of what describes it is if i go really far outside the box,0,0,0,0,0,0,0,0,0,0
18,Sandalwood,3372,is memory associated with scent,0,0,0,0,0,0,0,0,0,0
18,Sandalwood,3373,because that explains why i have no memory,0,0,0,0,0,0,0,0,0,0
18,Sandalwood,3374,comforting,0,0,0,0,0,0,0,0,1,0
18,Sandalwood,3375,lik a mother's embrace,1,0,0,0,0,0,0,0,0,0
18,Magnolia,3376,like a book,1,0,0,0,0,0,0,0,0,0
18,Magnolia,3377,blossom,1,0,0,0,0,0,0,0,0,0
18,Wintergreen,3378,its definitely smelt this in like an incense shop,0,0,0,0,0,0,1,0,0,0
18,Wintergreen,3379,or perfume whatever,1,0,0,0,0,0,0,0,0,0
18,Wintergreen,3380,oh wait this is in the car family,1,0,0,0,0,0,0,0,0,0
18,Wintergreen,3381,its like what you clean leather with,1,0,0,0,0,0,0,0,0,0
18,Ambergris,3382,im gonna say,0,0,0,0,0,0,0,0,0,0
18,Ambergris,3383,for some reason im thinking of walking through the supermarket,1,0,0,0,0,0,0,0,0,0
18,Ambergris,3384,but its not what it smells like,0,0,0,0,0,0,0,0,0,0
18,Ambergris,3385,or maybe it is,0,0,0,0,0,0,0,0,0,0
18,Ambergris,3386,synthetic flower,1,0,0,0,0,0,0,0,0,1
18,Ambergris,3387,it aint real my friend,0,0,0,0,0,0,0,0,0,1
18,Ambergris,3388,i dont fall for this,0,0,0,0,0,0,0,0,0,0
18,Dark Oud,3389,smells like  ok im gonna say vicks,1,0,0,0,0,0,0,0,0,0
18,Dark Oud,3390,but my specific answer when you,0,0,0,0,0,0,0,0,0,0
18,Dark Oud,3391,i mean this is just the scent of vicks but diluted like when you ,1,0,0,0,0,0,0,0,0,0
18,Dark Oud,3392,"if you have a blocked nose, you get boiling water and you put vicks into it and you steam it",1,0,0,0,0,0,0,0,0,0
18,Dark Oud,3393,"and you smell it, it smells exactly like that",0,0,0,0,0,0,0,0,0,0
18,Apricot,3394,oh a pleasant ending,0,1,0,0,0,0,0,0,0,0
18,Apricot,3395,peaches is what it reminds me of at least,1,0,0,0,0,0,0,0,0,0
18,Apricot,3396,i dont think it necessarily smells like peaches,1,0,0,0,0,0,0,0,0,0
18,Apricot,3397,but that is what i associate with it,0,0,0,0,0,0,0,0,0,0
19,Geosmin,3398,this smells like musky and quite,1,0,0,0,0,0,0,0,0,0
19,Geosmin,3399,has a bit of a cinn- cinnamon like smell,1,0,0,0,0,0,0,0,0,0
19,Sea Minerals,3400,this one smells a bit citrusy,1,0,0,0,0,0,0,0,0,0
19,Sea Minerals,3401,a lemon,1,0,0,0,0,0,0,0,0,0
19,Sea Minerals,3402,yeah,0,0,0,0,0,0,0,0,0,0
19,Labdanum,3403,yeah,0,0,0,0,0,0,0,0,0,0
19,Labdanum,3404,ew,0,0,1,0,0,0,0,0,0,0
19,Labdanum,3405,this one has like a medicinal scent to it,1,0,0,0,0,0,0,0,0,0
19,Labdanum,3406,like something i would drink if i was sick,1,0,0,0,0,0,0,0,0,0
19,Cedramber,3407,this one smells musky as well,1,0,0,0,0,0,0,0,0,0
19,Cedramber,3408,quite a relaxing scent,0,0,0,0,0,0,0,0,1,0
19,Lily of the Valley,3409,i think this has,0,0,0,0,0,0,0,0,0,0
19,Lily of the Valley,3410,smells like lavender,1,0,0,0,0,0,0,0,0,0
19,Lily of the Valley,3411,more on the floral side,1,0,0,0,0,0,0,0,0,0
19,Clove,3412,how interesting umm,0,0,0,0,0,0,0,0,1,0
19,Clove,3413,this one kinda smells like herbs yeah not too sure,1,0,0,0,0,0,0,0,0,0
19,Green Fig,3414,this has like a strong fruit smell,1,0,0,1,0,0,0,0,0,0
19,Green Fig,3415,but its not citrus yeah,1,0,0,0,0,0,0,0,0,0
19,Vetiver,3416,this kinda smells like industrial,1,0,0,0,0,0,0,0,0,0
19,Vetiver,3417,like from a factory kind of,1,0,0,0,0,0,0,0,0,0
19,Musk,3418,hmm this one kinda smells like oriental,0,0,0,0,0,1,0,0,0,0
19,Mint,3419,oh this is like very minty,1,0,0,0,0,0,0,0,0,0
19,Frankincense,3420,umm this one smells musky as well,1,0,0,0,0,0,0,0,0,0
19,Frankincense,3421,with a little bit of mint,1,0,0,0,0,0,0,0,0,0
19,White Tea,3422,this smells like lemongrass,1,0,0,0,0,0,0,0,0,0
19,Cedar,3423,this smells like orange medicine,2,0,0,0,0,0,0,0,0,0
19,Ginger,3424,yeah this one also smells like medicine,1,0,0,0,0,0,0,0,0,0
19,Patchouli,3425,umm this one also smells quite like the outdoors,1,0,0,0,0,0,0,0,0,0
19,Civet,3426,oh this smells like rose,1,0,0,0,0,0,0,0,0,0
19,Cardamom,3427,this is like vaporub,1,0,0,0,0,0,0,0,0,0
19,Sweet Vanilla,3428,oh this one smells like butter menthol,1,0,0,0,0,0,0,0,0,0
19,Geranium,3429,umm like a lemon and citrus scent,2,0,0,0,0,0,0,0,0,0
19,Leather,3430,hmm cinnamon,1,0,0,0,0,0,0,0,0,0
19,White Musk,3431,this one smells like flowers,1,0,0,0,0,0,0,0,0,0
19,Grapefruit,3432,umm this one smells like powdery lemon,1,0,0,0,0,1,0,0,0,0
19,Almond,3433,oh this is like cherry flavour,1,0,0,0,0,0,0,0,0,0
19,Chamomile,3434,im not sure it just smells very pungent,0,0,0,1,0,0,0,0,0,0
19,Wattle,3435,oh this is like a sweet floral scent i guess,1,0,0,0,0,1,0,0,0,0
19,Caraway Seed,3436,umm this just smells quite dark,0,0,0,0,0,1,0,0,0,0
19,Floral Ozone,3437,this one smells like old water,1,0,0,0,0,1,0,0,0,0
19,Wintergreen,3438,yeah this smells quite medicinal and menthol,2,0,0,0,0,0,0,0,0,0
19,Honeysuckle,3439,hmm this is like toilet cleaner,1,0,0,0,0,0,0,0,0,0
19,Guaiacol,3440,this one also smells like medicine,1,0,0,0,0,0,0,0,0,0
19,Apricot,3441,this is umm very subtle citrus,1,0,0,0,1,0,0,0,0,0
19,Ambergris,3442,its like meditation oils,1,0,0,0,0,0,0,0,0,0
19,Nutmeg,3443,smells like rubber,1,0,0,0,0,0,0,0,0,0
19,Mangolia,3444,this is like orange and lemon,2,0,0,0,0,0,0,0,0,0
19,Sandalwood,3445,smells like chlorine,1,0,0,0,0,0,0,0,0,0
19,Lavender,3446,this also has like a musky smell,1,0,0,0,0,0,0,0,0,0
19,Rosewood,3447,this one tastes,0,0,0,0,0,0,0,0,0,0
19,Rosewood,3448,i mean smells herbal,1,0,0,0,0,0,0,0,0,0
19,Dark Oud,3449,very strong,0,0,0,1,0,0,0,0,0,0
19,Dark Oud,3450,like plant extract smell,1,0,0,0,0,0,0,0,0,0
19,Lilac,3451,this one smells like herbs,1,0,0,0,0,0,0,0,0,0
19,Orange Blossom,3452,this is quite fruity,1,0,0,0,0,0,0,0,0,0
20,Lilac,3453,hmm smells like,0,0,0,0,0,0,0,0,0,0
20,Lilac,3454,i dont even know,0,0,0,0,0,0,0,0,0,0
20,Lilac,3455,some kind of spice i would say,1,0,0,0,0,0,0,0,0,0
20,Lilac,3456,or like,0,0,0,0,0,0,0,0,0,0
20,Dark Oud,3457,like a tree or something along those lines,1,0,0,0,0,0,0,0,0,0
20,Dark Oud,3458,like im smelling a piece of wood,1,0,0,0,0,0,0,0,0,0
20,Wattle,3459,bubblegum,1,0,0,0,0,0,0,0,0,0
20,Wattle,3460,or like some sort of candy,1,0,0,0,0,0,0,0,0,0
20,Rosewood,3461,fuck what is it,0,0,0,0,0,0,0,0,0,0
20,Rosewood,3462,"some kind of herb, i cant remember the name",1,0,0,0,0,0,0,0,0,0
20,Orange Blossom,3463,oh umm oh my god,0,0,0,0,0,0,0,0,0,0
20,Orange Blossom,3464,i dont know what they call it but its literally what i used as a kid for my shampoo,1,0,0,0,0,0,0,0,0,0
20,Orange Blossom,3465,cant remember the brand,0,0,0,0,0,0,0,0,0,0
20,Grapefruit,3466,hmm,0,0,0,0,0,0,0,0,0,0
20,Grapefruit,3467,exactly the same as the other one for some reason,1,0,0,0,0,0,0,0,0,0
20,Grapefruit,3468,i would say baby i dont know shampoo you use as a baby,1,0,0,0,0,0,0,0,0,0
20,Grapefruit,3469,cologne,1,0,0,0,0,0,0,0,0,0
20,Grapefruit,3470,you use as a baby,1,0,0,0,0,0,0,0,0,0
20,Grapefruit,3471,for a baby,1,0,0,0,0,0,0,0,0,0
20,Grapefruit,3472,for like to make them smell nice,0,1,0,0,0,0,0,0,0,0
20,Chamomile,3473,oh,0,0,0,0,0,0,0,0,0,0
20,Chamomile,3474,fuck,0,0,0,0,0,0,0,0,0,0
20,Chamomile,3475,dont know how to say it but some kind of alcohol like a strong alcohol like a storng spirit,1,0,0,0,0,0,0,0,0,0
20,Chamomile,3476,but very similar to the candy one,1,0,0,0,0,0,0,0,0,0
20,Chamomile,3477,but a stronger smell,0,0,0,1,0,0,0,0,0,0
20,White Tea,3478,grass,1,0,0,0,0,0,0,0,0,0
20,Cardamom,3479,i dont know if this is right but it smells like chilli,1,0,0,0,0,0,0,0,0,0
20,Cardamom,3480,like what chilli would taste like if you smell it,1,0,0,0,0,0,0,0,0,0
20,Almond,3481,oh medicine,1,0,0,0,0,0,0,0,0,0
20,Almond,3482,cough syrup,1,0,0,0,0,0,0,0,0,0
20,Civet,3483,dont really have a smell for this,0,0,0,0,0,0,0,0,0,0
20,Civet,3484,umm,0,0,0,0,0,0,0,0,0,0
20,Civet,3485,i actually dont know,0,0,0,0,0,0,0,0,0,0
20,Civet,3486,id say like,0,0,0,0,0,0,0,0,0,0
20,Civet,3487,some kind of perfume that id use,1,0,0,0,0,0,0,0,0,0
20,Civet,3488,thats the only description i can give for that one,0,0,0,0,0,0,0,0,0,0
20,Frankincense,3489,I would say,0,0,0,0,0,0,0,0,0,0
20,Frankincense,3490,like this legit smells like when i go to church,1,0,0,0,0,0,0,0,0,0
20,Frankincense,3491,like catholic cuhrch,1,0,0,0,0,0,0,0,0,0
20,Frankincense,3492,what they use as an incense,1,0,0,0,0,0,0,0,0,0
20,Geranium,3493,hmm,0,0,0,0,0,0,0,0,0,0
20,Geranium,3494,i have a smell for this,0,0,0,0,0,0,0,0,0,0
20,Geranium,3495,id say like some kind of flower but i dont know which one,1,0,0,0,0,0,0,0,0,0
20,Geranium,3496,some kind of lavender,1,0,0,0,0,0,0,0,0,0
20,Sandalwood,3497,i would say this one smells like,0,0,0,0,0,0,0,0,0,0
20,Sandalwood,3498,dont know if its acurate,0,0,0,0,0,0,0,0,0,0
20,Sandalwood,3499,lavender,1,0,0,0,0,0,0,0,0,0
20,Sandalwood,3500,some kind of flower i just dont know which one,1,0,0,0,0,0,0,0,0,0
20,Lily of the Valley,3501,spices again like a strong,1,0,0,1,0,0,0,0,0,0
20,Lily of the Valley,3502,cant say what spice,0,0,0,0,0,0,0,0,0,0
20,Lily of the Valley,3503,"its like that stick, brown stick whats it called",1,0,0,0,0,0,0,0,0,0
20,Lily of the Valley,3504,i dont know its like a strong spice to me,1,0,0,1,0,0,0,0,0,0
20,Cedar,3505,umm alcohol,1,0,0,0,0,0,0,0,0,0
20,Cedar,3506,dont know what because i dont drink,0,0,0,0,0,0,0,0,0,0
20,Cedramber,3507,oh my god fuck,0,0,0,0,0,0,0,0,0,0
20,Cedramber,3508,ginger? yeah ginger,2,0,0,0,0,0,0,0,0,0
20,Sea Minerals,3509,ah fuck,0,0,0,0,0,0,0,0,0,0
20,Sea Minerals,3510,trying to memorise like recall what it is but i just cant,0,0,0,0,0,0,0,0,0,0
20,Sea Minerals,3511,oh whats it smell like,0,0,0,0,0,0,0,0,0,0
20,Sea Minerals,3512,smells like a sri lankan food i used to have as a kid i just cant recall what it is,1,0,0,0,0,0,0,0,0,0
20,Sea Minerals,3513,oh my god that literally takes me back to like kindergarten,0,0,0,0,0,0,1,0,0,0
20,Labdanum,3514,alcohol straight away ,1,0,0,0,0,0,0,0,0,0
20,Labdanum,3515,i would say,0,0,0,0,0,0,0,0,0,0
20,Ambergris,3516,its like a hint of ginger again,1,0,0,0,0,0,0,0,0,0
20,Ambergris,3517,but same as alcohol just a little different,1,0,0,0,0,1,0,0,0,0
20,Vetiver,3518,chlorine,1,0,0,0,0,0,0,0,0,0
20,Vetiver,3519,reminds me of a swimming pool,1,0,0,0,0,0,0,0,0,0
20,Musk,3520,its flowers again,1,0,0,0,0,0,0,0,0,0
20,Musk,3521,just dont know which flower,0,0,0,0,0,0,0,0,0,0
20,Geosmin,3522,i would say spice umm but,1,0,0,0,0,0,0,0,0,0
20,Geosmin,3523,but what is it called,0,0,0,0,0,0,0,0,0,0
20,Geosmin,3524,just dont know what its called,0,0,0,0,0,0,0,0,0,0
20,Geosmin,3525,id go with spices,1,0,0,0,0,0,0,0,0,0
20,Ginger,3526,oh my god what is this,0,0,0,0,0,0,0,0,0,0
20,Ginger,3527,hmm this smells like one of the teas at gong cha,1,0,0,0,0,0,0,0,0,0
20,Ginger,3528,i tihnk its earl grey pretty sure,1,0,0,0,0,0,0,0,0,0
20,Ginger,3529,its a pretty distinctive smell,0,0,0,0,0,1,0,0,0,0
20,Clove,3530,fuck its a seed that i use in food,1,0,0,0,0,0,0,0,0,0
20,Clove,3531,and when i bite into it it doesnt taste nice,0,0,1,0,0,0,0,0,0,0
20,Clove,3532,not a seed fuck dont know what its called,0,0,0,0,0,0,0,0,0,0
20,Clove,3533,i dont know what its called,0,0,0,0,0,0,0,0,0,0
20,Clove,3534,"but id say like most of them have been, thats spice",1,0,0,0,0,0,0,0,0,0
20,Clove,3535,or its like a food additive,1,0,0,0,0,0,0,0,0,0
20,Green Fig,3536,one of the perfumes i have at home,1,0,0,0,0,0,0,0,0,0
20,Green Fig,3537,and its something else too,0,0,0,0,0,0,0,0,0,0
20,Green Fig,3538,i feel like its one of the,0,0,0,0,0,0,0,0,0,0
20,Green Fig,3539,dunno what fruit but it reminds me of fruit for some reason,2,0,0,0,0,0,0,0,0,0
20,Patchouli,3540,ginger again,1,0,0,0,0,0,0,0,0,0
20,Lavender,3541,smells like last time i went on a holiday,1,0,0,0,0,0,0,0,0,0
20,Lavender,3542,like the house,1,0,0,0,0,0,0,0,0,0
20,Lavender,3543,thats the only thing that hits me straight away,0,0,0,0,0,0,0,0,0,0
20,Guaiacol,3544,this smells like gone off food,1,0,0,0,0,0,0,0,0,0
20,Guaiacol,3545,yep,0,0,0,0,0,0,0,0,0,0
20,Floral Ozone,3546,chlorine again or like,1,0,0,0,0,0,0,0,0,0
20,Floral Ozone,3547,yeah chlorine,1,0,0,0,0,0,0,0,0,0
20,Honeysuckle,3548,smells the same,1,0,0,0,0,0,0,0,0,0
20,Honeysuckle,3549,this smells like my calvin klein perfume,1,0,0,0,0,0,0,0,0,0
20,Wintergreen,3550,oh umm vaporub,1,0,0,0,0,0,0,0,0,0
20,Wintergreen,3551,like vicks i think,1,0,0,0,0,0,0,0,0,0
20,Apricot,3552,smells like lollies or like snakes,2,0,0,0,0,0,0,0,0,0
20,Apricot,3553,the pack,0,0,0,0,0,0,0,0,0,0
20,Nutmeg,3554,for some reason it smells like,0,0,0,0,0,0,0,0,0,0
20,Nutmeg,3555,i dont know if this is the right word or the right spice,0,0,0,0,0,0,0,0,0,0
20,Nutmeg,3556,but cumin?,1,0,0,0,0,0,0,0,0,0
20,Nutmeg,3557,like the powder,1,0,0,0,0,0,0,0,0,0
20,Sweet Vanilla,3558,oh my god vanilla,1,0,0,0,0,0,0,0,0,0
20,Sweet Vanilla,3559,like vanilla air freshener,2,0,0,0,0,0,0,0,0,0
20,Caraway Seed,3560,oh big mac,1,0,0,0,0,0,0,0,0,0
20,Caraway Seed,3561,oh yea hthis smells like a big mac oh,1,0,0,0,0,0,0,0,0,0
20,Caraway Seed,3562,id say i dont know like for some reason im thinking like,0,0,0,0,0,0,0,0,0,0
20,Caraway Seed,3563,savoury oily food and big mac sauce,3,0,0,0,0,1,0,0,0,0
20,Magnolia,3564,umm smells like rose,1,0,0,0,0,0,0,0,0,0
20,Magnolia,3565,like,0,0,0,0,0,0,0,0,0,0
20,Magnolia,3566,rose syrup,1,0,0,0,0,0,0,0,0,0
20,Magnolia,3567,that would i dont know,0,0,0,0,0,0,0,0,0,0
20,Leather,3568,oh my god,0,0,0,0,0,0,0,0,0,0
20,Leather,3569,i dont know how to say it,0,0,0,0,0,0,0,0,0,0
20,Leather,3570,for some reason im thinking like a block of wood,1,0,0,0,0,0,0,0,0,0
20,Leather,3571,or like a fershly sprayed deck,1,0,0,0,0,1,0,0,0,0
20,Mint,3572,oh mint or chewing gum,2,0,0,0,0,0,0,0,0,0
20,White Musk,3573,i dont have a description for this,0,0,0,0,0,0,0,0,0,0
20,White Musk,3574,it smells like,0,0,0,0,0,0,0,0,0,0
20,White Musk,3575,i dontknow for some reason im thinking the saem as the block of wood i was talking about before,1,0,0,0,0,0,0,0,0,0
20,White Musk,3576,like a tree i would say as well,1,0,0,0,0,0,0,0,0,0
21,Lilac,3577,oh my god i know this,0,0,0,0,0,0,1,0,0,0
21,Lilac,3578,smells like candle,1,0,0,0,0,0,0,0,0,0
21,Lilac,3579,flower,1,0,0,0,0,0,0,0,0,0
21,Lilac,3580,smells like soap,1,0,0,0,0,0,0,0,0,0
21,Frankincense,3581,smells like a candle,1,0,0,0,0,0,0,0,0,0
21,Frankincense,3582,are these all candle smells like flowers,2,0,0,0,0,0,0,0,0,0
21,Frankincense,3583,is this menthol?,1,0,0,0,0,0,0,0,0,0
21,Frankincense,3584,ok i think its menthol,1,0,0,0,0,0,0,0,0,0
21,Almond,3585,oh this is cherry like umm the starburst cherry,2,0,0,0,0,0,0,0,0,0
21,Almond,3586,the red one,0,0,0,0,0,0,0,0,0,0
21,Almond,3587,smells like that,0,0,0,0,0,0,0,0,0,0
21,Sea Minerals,3588,this one smells like cologne,1,0,0,0,0,0,0,0,0,0
21,Sea Minerals,3589,mens cologne,1,0,0,0,0,0,0,0,0,0
21,Sea Minerals,3590,like lynx,1,0,0,0,0,0,0,0,0,0
21,Geranium,3591,this is rose i feel,1,0,0,0,0,0,0,0,0,0
21,Labdanum,3592,smells like,0,0,0,0,0,0,0,0,0,0
21,Labdanum,3593,like,0,0,0,0,0,0,0,0,0,0
21,Labdanum,3594,like liquor like dark in chocolate liquor you know,2,0,0,0,0,0,0,0,0,0
21,Labdanum,3595,i dont know,0,0,0,0,0,0,0,0,0,0
21,Wattle,3596,lavender,1,0,0,0,0,0,0,0,0,0
21,Chamomile,3597,oh stinks,0,0,1,0,0,0,0,0,0,0
21,Chamomile,3598,that just shook me to the core,0,0,0,0,0,0,0,0,1,0
21,Chamomile,3599,oh this,0,0,0,0,0,0,0,0,0,0
21,Chamomile,3600,oh,0,0,0,0,0,0,0,0,0,0
21,Chamomile,3601,alcohol,1,0,0,0,0,0,0,0,0,0
21,Cedramber,3602,smells like i dont know,0,0,0,0,0,0,0,0,0,0
21,Cedramber,3603,wait cant smell,0,0,0,0,0,0,0,0,0,0
21,Cedramber,3604,this one just smells like,0,0,0,0,0,0,0,0,0,0
21,Cedramber,3605,just smells like soap,1,0,0,0,0,0,0,0,0,0
21,Cedramber,3606,soap,1,0,0,0,0,0,0,0,0,0
21,Cedramber,3607,this smells like you know when you go to like candles stores,1,0,0,0,0,0,0,0,0,0
21,Cedramber,3608,just smells they all smell the same,1,0,0,0,0,0,0,0,0,0
21,Civet,3609,this smells like baby powder,1,0,0,0,0,0,0,0,0,0
21,Civet,3610,yeah,0,0,0,0,0,0,0,0,0,0
21,Civet,3611,maybe,0,0,0,0,0,0,0,0,0,0
21,Dark Oud,3612,ugh,0,0,0,0,0,0,0,0,0,0
21,Dark Oud,3613,like toxic,0,0,1,0,0,1,0,0,0,0
21,Dark Oud,3614,smells like petrol,1,0,0,0,0,0,0,0,0,0
21,Dark Oud,3615,i dont like that one,0,0,1,0,0,0,0,0,0,0
21,Dark Oud,3616,umm smells like fumes,1,0,0,0,0,0,0,0,0,0
21,Dark Oud,3617,like chemical fumes,1,0,0,0,0,0,0,0,0,0
21,Orange Blossom,3618,im losing words i dont know what else to say,0,0,0,0,0,0,0,0,0,0
21,Orange Blossom,3619,smells like a flower,1,0,0,0,0,0,0,0,0,0
21,Orange Blossom,3620,rose i think ive said that before,1,0,0,0,0,0,0,0,0,0
21,Orange Blossom,3621,yeah rose,1,0,0,0,0,0,0,0,0,0
21,Guaiacol,3622,this smells like a wet towel,1,0,0,0,0,1,0,0,0,0
21,Guaiacol,3623,you know like a wet towel that hasnt properly dried up,1,0,0,0,0,1,0,0,0,0
21,Ginger,3624,this is really hard,0,0,0,0,0,0,0,0,0,0
21,Ginger,3625,smells like hmm,0,0,0,0,0,0,0,0,0,0
21,Ginger,3626,grapes,1,0,0,0,0,0,0,0,0,0
21,Ginger,3627,but also with a little bit of menthol in it,1,0,0,0,0,0,0,0,0,0
21,Cedar,3628,it stinks,0,0,1,0,0,0,0,0,0,0
21,Cedar,3629,hmm,0,0,0,0,0,0,0,0,0,0
21,Cedar,3630,it smells the same as something else ive smelt earlier,1,0,0,0,0,0,0,0,0,0
21,Cedar,3631,smells like liquor,1,0,0,0,0,0,0,0,0,0
21,Apricot,3632,this one smells like sweet,0,0,0,0,0,1,0,0,0,0
21,Apricot,3633,mango,1,0,0,0,0,0,0,0,0,0
21,Apricot,3634,mango passionfruit,2,0,0,0,0,0,0,0,0,0
21,Apricot,3635,like fruity,1,0,0,0,0,0,0,0,0,0
21,Nutmeg,3636,oh the worst smell,0,0,1,0,0,0,0,0,0,0
21,Nutmeg,3637,this one stinks,0,0,1,0,0,0,0,0,0,0
21,Nutmeg,3638,smells like grass,1,0,0,0,0,0,0,0,0,0
21,Nutmeg,3639,actually maybe not grass,1,0,0,0,0,0,0,0,0,0
21,Nutmeg,3640,it smells like chinese medicine,1,0,0,0,0,0,0,0,0,0
21,Mangolia,3641,smells like perfume,1,0,0,0,0,0,0,0,0,0
21,Mangolia,3642,like a floral perfume,2,0,0,0,0,0,0,0,0,0
21,Mangolia,3643,yeah,0,0,0,0,0,0,0,0,0,0
21,Geosmin,3644,this smells like a wood spice,1,0,0,0,0,0,0,0,0,0
21,Geosmin,3645,like spicy,1,0,0,0,0,0,0,0,0,0
21,Geosmin,3646,old spice,1,0,0,0,0,0,0,0,0,0
21,Geosmin,3647,i dont know what you call men deoderant,1,0,0,0,0,0,0,0,0,0
21,Geosmin,3648,spice,1,0,0,0,0,0,0,0,0,0
21,Wintergreen,3649,this one smells like chinese medicine,1,0,0,0,0,0,0,0,0,0
21,Wintergreen,3650,like a tiger balm,1,0,0,0,0,0,0,0,0,0
21,Wintergreen,3651,"like massage, you know when massaging",1,0,0,0,0,0,0,0,0,0
21,Lavender,3652,smells like a toilet air freshener,1,0,0,0,0,0,0,0,0,0
21,Grapefruit,3653,this one smells like insect repellant,1,0,0,0,0,0,0,0,0,0
21,Vetiver,3654,just like feet,1,0,0,0,0,0,0,0,0,0
21,Vetiver,3655,smells like feet,1,0,0,0,0,0,0,0,0,0
21,Floral Ozone,3656,hmm,0,0,0,0,0,0,0,0,0,0
21,Floral Ozone,3657,smells,0,0,0,0,0,0,0,0,0,0
21,Floral Ozone,3658,i dont know how to describe it,0,0,0,0,0,0,0,0,0,0
21,Floral Ozone,3659,i dont know this one is a hard one,0,0,0,0,0,0,0,0,0,0
21,Floral Ozone,3660,just smells woody,0,0,0,0,0,1,0,0,0,0
21,Floral Ozone,3661,thats all i can describe that one,0,0,0,0,0,0,0,0,0,0
21,Floral Ozone,3662,actually no it smells like the forest,1,0,0,0,0,0,0,0,0,0
21,Floral Ozone,3663,rain forest,1,0,0,0,0,0,0,0,0,0
21,Floral Ozone,3664,its got that like grassy smell,1,0,0,0,0,0,0,0,0,0
21,Patchouli,3665,that stinks,0,0,1,0,0,0,0,0,0,0
21,Patchouli,3666,just very spicy,1,0,0,0,0,0,0,0,0,0
21,Patchouli,3667,like smells like chocolate and spice,2,0,0,0,0,0,0,0,0,0
21,Rosewood,3668,"smells like corriander, corriander",2,0,0,0,0,0,0,0,0,0
21,Ambergris,3669,its very sweet,0,0,0,0,0,1,0,0,0,0
21,Ambergris,3670,smells like umm you know textas you know when you sniff it,1,0,0,0,0,0,0,0,0,0
21,Ambergris,3671,smells like that,0,0,0,0,0,0,0,0,0,0
21,Cardamom,3672,ugh that one stinks,0,0,1,0,0,0,0,0,0,0
21,Cardamom,3673,that one smells like um like umm,0,0,0,0,0,0,0,0,0,0
21,Cardamom,3674,geez that stinks,0,0,1,0,0,0,0,0,0,0
21,Cardamom,3675,smells like umm like off like fish,1,0,0,0,0,1,0,0,0,0
21,Cardamom,3676,meat,1,0,0,0,0,0,0,0,0,0
21,Cardamom,3677,ugh,0,0,1,0,0,0,0,0,0,0
21,White Tea,3678,oh my gosh i know this smell,0,0,0,0,0,0,1,0,0,0
21,White Tea,3679,lemongrass,1,0,0,0,0,0,0,0,0,0
21,White Tea,3680,i think,0,0,0,0,0,0,0,0,0,0
21,Sandalwood,3681,this ones very woody,1,0,0,0,0,0,0,0,0,0
21,Sandalwood,3682,i think i said that for every second one,0,0,0,0,0,0,0,0,0,0
21,Sandalwood,3683,yeah just woody,1,0,0,0,0,0,0,0,0,0
21,White Musk,3684,hmm,0,0,0,0,0,0,0,0,0,0
21,White Musk,3685,very,0,0,0,0,0,0,0,0,0,0
21,White Musk,3686,it smells like fumes,1,0,0,0,0,0,0,0,0,0
21,White Musk,3687,chemical fumes,1,0,0,0,0,0,0,0,0,0
21,White Musk,3688,like in a labratory,1,0,0,0,0,0,0,0,0,0
21,White Musk,3689,actually,0,0,0,0,0,0,0,0,0,0
21,White Musk,3690,i dont know how to describe it,0,0,0,0,0,0,0,0,0,0
21,White Musk,3691,just smells like chemical fumes i cant,1,0,0,0,0,0,0,0,0,0
21,Clove,3692,ugh ugh that one stinks as well,0,0,1,0,0,0,0,0,0,0
21,Clove,3693,oh,0,0,0,0,0,0,0,0,0,0
21,Clove,3694,i know this smell but,0,0,0,0,0,0,1,0,0,0
21,Clove,3695,umm,0,0,0,0,0,0,0,0,0,0
21,Clove,3696,grass?,1,0,0,0,0,0,0,0,0,0
21,Clove,3697,like,0,0,0,0,0,0,0,0,0,0
21,Clove,3698,umm,0,0,0,0,0,0,0,0,0,0
21,Clove,3699,hmm,0,0,0,0,0,0,0,0,0,0
21,Clove,3700,i dont know,0,0,0,0,0,0,0,0,0,0
21,Clove,3701,i dont really,0,0,0,0,0,0,0,0,0,0
21,Clove,3702,its got i dont know strong,0,0,0,1,0,0,0,0,0,0
21,Clove,3703,strong like,0,0,0,1,0,0,0,0,0,0
21,Clove,3704,what smells like that,0,0,0,0,0,0,0,0,0,0
21,Clove,3705,i dont know it smells like old wet decomposing grass,1,0,0,0,0,0,0,0,0,0
21,Honeysuckle,3706,flower,1,0,0,0,0,0,0,0,0,0
21,Honeysuckle,3707,i tihnk like cherry blossom maybe,1,0,0,0,0,0,0,0,0,0
21,Honeysuckle,3708,flower,1,0,0,0,0,0,0,0,0,0
21,Honeysuckle,3709,hmm,0,0,0,0,0,0,0,0,0,0
21,Honeysuckle,3710,candle,1,0,0,0,0,0,0,0,0,0
21,Green Fig,3711,this smells like tobacco,1,0,0,0,0,0,0,0,0,0
21,Green Fig,3712,yeah i think so,0,0,0,0,0,0,0,0,0,0
21,Musk,3713,this smells like,0,0,0,0,0,0,0,0,0,0
21,Musk,3714,smells like toilet freshener,1,0,0,0,0,0,0,0,0,0
21,Musk,3715,air freshener,1,0,0,0,0,0,0,0,0,0
21,Musk,3716,smells like leaves,1,0,0,0,0,0,0,0,0,0
21,Musk,3717,yeah im sticking with leaves,1,0,0,0,0,0,0,0,0,0
21,Musk,3718,smells like leaves to me,1,0,0,0,0,0,0,0,0,0
21,Caraway Seed,3719,this smells like really really strong candy,1,0,0,1,0,0,0,0,0,0
21,Caraway Seed,3720,maybe like marshmellow,1,0,0,0,0,0,0,0,0,0
