PARTICIPANT,SCENT,DESCRIPTOIN NO.,TEXT,SOURCE,POSITIVE,NEGATIVE,STRONG,WEAK,ABSTRACT,FAMILIAR,UNFAMILIAR,EFFECT,COMPOSITION
16,Civet,2981,that smell that kind of like,0,0,0,0,0,0,0,0,0,0
16,Civet,2982,that like slightly burns your nose like minty but not really there because its something else,1,0,0,0,0,0,0,0,1,0
16,Civet,2983,but it doesnt smell like it either,0,0,0,0,0,0,0,0,0,0
16,Sweet Vanilla,2984,is this one edible,1,0,0,0,0,0,0,0,0,0
16,Sweet Vanilla,2985,it that its like sweet,0,0,0,0,0,1,0,0,0,0
16,Sweet Vanilla,2986,someting that ive eaten before,0,0,0,0,0,0,1,0,0,0
16,Sweet Vanilla,2987,i wanna say like vaniull abut like a sweet vanilla,2,0,0,0,0,1,0,0,0,0
16,Sweet Vanilla,2988,"i dont know, chaptstick?",1,0,0,0,0,0,0,0,0,0
16,Sweet Vanilla,2989,something like candy flavoured,1,0,0,0,0,0,0,0,0,0
16,Frankincense,2990,its like the other the other like the other medicinal smelling ones,1,0,0,0,0,0,0,0,0,0
16,Frankincense,2991,but like like earthy as well and i kinda picture wet bark came to mind,2,0,0,0,0,0,0,0,0,0
16,Frankincense,2992,yeah like wet tree,1,0,0,0,0,0,0,0,0,0
16,Cedramber,2993,i dont know if its me or not but htis one smells a lot similar to like i think its was one of the earlier ones like,1,0,0,0,0,0,0,0,0,0
16,Cedramber,2994,like i dont know but now its starting to smell like baby powder so,1,0,0,0,0,0,0,0,0,0
16,Cedramber,2995,yeah like an unpleasant baby powder kinda smell,1,0,1,0,0,0,0,0,0,0
16,Nutmeg,2996,like something like,0,0,0,0,0,0,0,0,0,0
16,Nutmeg,2997,i dont know like,0,0,0,0,0,0,0,0,0,0
16,Nutmeg,2998,all reminds me of rotten or like really really bad or off,0,0,0,0,0,1,0,0,0,0
16,Nutmeg,2999,like those you know those really bad jelly bean stuff and you have to guess them as stuff,1,0,1,0,0,0,0,0,0,0
16,Nutmeg,3000,and you have to eat them and guess the taste,0,0,0,0,0,0,0,0,0,0
16,Nutmeg,3001,thats what it smells like when you get the wrong one,1,0,0,0,0,0,0,0,0,0
16,Nutmeg,3002,like stinky socks or something,1,0,1,0,0,0,0,0,0,0
16,Mint,3003,toothpaste or something minty,2,0,0,0,0,0,0,0,0,0
16,Mint,3004,yep or like mouthwash,1,0,0,0,0,0,0,0,0,0
16,Patchouli,3005,im convinced youre giving me the same ones sometimes,0,0,0,0,0,0,0,0,0,0
16,Patchouli,3006,because it smells a lot like the other one i dont know which one it was,1,0,0,0,0,0,0,0,0,0
16,Patchouli,3007,but like like that that medicinal bark mint kinda smell,1,0,0,0,0,0,0,0,0,0
16,Patchouli,3008,yeah like earthy stuff,1,0,0,0,0,0,0,0,0,0
16,Musk,3009,like a cologne like,1,0,0,0,0,0,0,0,0,0
16,Musk,3010,it smells like a cologne my dad uses,2,0,0,0,0,0,0,0,0,0
16,Musk,3011,i dont know something perfumey cologney something like that,2,0,0,0,0,0,0,0,0,0
16,Chamomile,3012,it smells like old,0,0,0,0,0,1,0,0,0,0
16,Chamomile,3013,something old and,1,0,0,0,0,0,0,0,0,0
16,Chamomile,3014,i wanna say lke old plastic but i dont think its plastic,1,0,0,0,0,1,0,0,0,0
16,Chamomile,3015,like old liqourice,1,0,0,0,0,1,0,0,0,0
16,Ambergris,3016,this one smells like a cologne as well,1,0,0,0,0,0,0,0,0,0
16,Ambergris,3017,yeah i cant describe that one but something my dad would use,1,0,0,0,0,0,0,0,0,0
16,Clove,3018,like sardines,1,0,0,0,0,0,0,0,0,0
16,Clove,3019,yeah i dont know it smells like fishy sardiney,2,0,0,0,0,0,0,0,0,0
16,Clove,3020,bad rotten type of smell,0,0,1,0,0,1,0,0,0,0
16,Almond,3021,like its fruity and then it smells like umm robutussen the cherry medicine thing,2,0,0,0,0,0,0,0,0,0
16,Almond,3022,that doesnt smell good either yep,0,0,1,0,0,0,0,0,0,0
16,Lilac,3023,like flowers,1,0,0,0,0,0,0,0,0,0
16,Lilac,3024,"yeah like you crush a flower and then you smell it, thats what it smells like",1,0,0,0,0,0,0,0,0,0
16,Geosmin,3025,i dont know all these ones smells the same again the wet bark medicinal smell,2,0,0,0,0,1,0,0,0,0
16,Ginger,3026,it smells like celery i think,1,0,0,0,0,0,0,0,0,0
16,Ginger,3027,or like a vegetable,1,0,0,0,0,0,0,0,0,0
16,Ginger,3028,like vegetable juice if you like blended it kinda thing,2,0,0,0,0,0,0,0,0,0
16,Wintergreen,3029,like kinda smells like vaporub like vicks,1,0,0,0,0,0,0,0,0,0
16,Wintergreen,3030,but like a bad off smelling one,0,0,1,0,0,0,0,0,0,0
16,Green Fig,3031,mangos i think,1,0,0,0,0,0,0,0,0,0
16,Green Fig,3032,fruity sweet mangos,2,0,0,0,0,1,0,0,0,0
16,Lily of the Valley,3033,it smells like like shampoo like,1,0,0,0,0,0,0,0,0,0
16,Lily of the Valley,3034,yeah like flowery nice smelling shampoo,2,1,0,0,0,0,0,0,0,0
16,Labdanum,3035,like i dont know if its like anti-septic yeah i think it smells like the iodine smells like whne you put it on a cut or something,2,0,0,0,0,0,0,0,0,0
16,Labdanum,3036,but yeah smells like that medical smell again,1,0,0,0,0,0,0,0,0,0
16,Lavender,3037,i think it smells like lavender,1,0,0,0,0,0,0,0,0,0
16,Lavender,3038,like an essential oil,1,0,0,0,0,0,0,0,0,0
16,Leather,3039,its got like a sweet smell but,0,0,0,0,0,1,0,0,0,0
16,Leather,3040,like that bark kind of smell again,1,0,0,0,0,0,0,0,0,0
16,Leather,3041,yeah like kinda sweet dirt kind of smell,1,0,0,0,0,1,0,0,0,0
16,Honeysuckle,3042,i wnana say it smells like a bland soap,1,0,0,0,1,0,0,0,0,0
16,Honeysuckle,3043,or like a bland medicine or like beause its kinda like sweet and pleasant,1,1,0,0,1,1,0,0,0,0
16,Honeysuckle,3044,but not like great that youd wanna buy it again,0,0,1,0,0,0,0,0,0,0
16,Dark Oud,3045,like rubber like the tyres car tyre rubber yeah,2,0,0,0,0,0,0,0,0,0
16,Dark Oud,3046,its really strong,0,0,0,1,0,0,0,0,0,0
16,Apricot,3047,its like a sweet fruity candy kinda smell,2,0,0,0,0,1,0,0,0,0
16,Apricot,3048,but i dont know what fruit like maybe vanilla citrusy kinda smell,3,0,0,0,0,0,0,0,0,0
16,Rosewood,3049,it smells like an essential oil but,1,0,0,0,0,0,0,0,0,0
16,Rosewood,3050,its not lavender but,1,0,0,0,0,0,0,0,0,0
16,Rosewood,3051,its one of those ...,0,0,0,0,0,0,0,0,0,0
16,Rosewood,3052,something like that,0,0,0,0,0,0,0,0,0,0
16,White Tea,3053,i dont know how to describe this one its like,0,0,0,0,0,0,0,0,0,0
16,White Tea,3054,somehting really nice like,0,1,0,0,0,0,0,0,0,0
16,White Tea,3055,i guess when you like go into a nice house not like a new house but likerelatives house like grandmas house and its got that nice ambience kinda thing,2,1,0,0,0,0,0,0,0,0
16,White Tea,3056,or like well like soapy like really nice soap,2,1,0,0,0,0,0,0,0,0
16,White Tea,3057,yeah,0,0,0,0,0,0,0,0,0,0
16,Cedar,3058,smells like the medicinal stuff again,1,0,0,0,0,0,0,0,0,0
16,Cedar,3059,it smells like that in primary shcool there used to be like you kow tanbark,2,0,0,0,0,0,0,0,0,0
16,Cedar,3060,and thered be a whole pile of it and you dig it and its warm and wet and thats what it smells like yeah,0,0,0,0,0,2,0,0,0,0
16,Orange Blossom,3061,like i thnk its oranges,1,0,0,0,0,0,0,0,0,0
16,Orange Blossom,3062,like the umm the outer peel of the orange yeah,1,0,0,0,0,0,0,0,0,0
16,Wattle,3063,it kinda reminds me of one of my hand sanitisers which is kinda like a sweet pea kinda smell,2,0,0,0,0,0,0,0,0,0
16,Wattle,3064,so like nice and soapy yeah,1,1,0,0,0,0,0,0,0,0
16,Grapefruit,3065,It kinda smells like,0,0,0,0,0,0,0,0,0,0
16,Grapefruit,3066,like  again like a medicinal kinda thing,1,0,0,0,0,0,0,0,0,0
16,Grapefruit,3067,and like a tree bark kind of one but,1,0,0,0,0,0,0,0,0,0
16,Grapefruit,3068,yeah kinda smells like,0,0,0,0,0,0,0,0,0,0
16,Grapefruit,3069,like a medicine I took when I was younger and I was sick,1,0,0,0,0,0,0,0,0,0
16,Grapefruit,3070,and kinda like go to the like the asia doctors that my mum would really trust,0,0,0,0,0,0,0,0,0,0
16,Grapefruit,3071,and they give me a medicine that really smells like this,1,0,0,0,0,0,0,0,0,0
17,Sandalwood,3072,it kinda smells like medicine,1,0,0,0,0,0,0,0,0,0
17,Sandalwood,3073,kinda like chinese medicine,1,0,0,0,0,0,0,0,0,0
17,Sandalwood,3074,yeah ok,0,0,0,0,0,0,0,0,0,0
17,Apricot,3075,it kinda smells like medicine,1,0,0,0,0,0,0,0,0,0
17,Apricot,3076,its like,0,0,0,0,0,0,0,0,0,0
17,Apricot,3077,"oh actually, yeah it kinda smells like medicine but it also smells like, like a softener for clothes and stuff",2,0,0,0,0,0,0,0,0,0
17,Apricot,3078,yeah ok,0,0,0,0,0,0,0,0,0,0
17,Wintergreen,3079,this smells like chinese medicine as well,1,0,0,0,0,0,0,0,0,0
17,Wintergreen,3080,is it its kinda like tiger balm i think,1,0,0,0,0,0,0,0,0,0
17,Wintergreen,3081,but maybe maybe not as strong,0,0,0,0,1,0,0,0,0,0
17,Wintergreen,3082,but like definitely something i feel my grandma has used before yep,1,0,0,0,0,0,0,0,0,0
17,Magnolia,3083,this also smells like a softener,1,0,0,0,0,0,0,0,0,0
17,Magnolia,3084,but its more subtle than the other one that i said was a softener,0,0,0,0,1,0,0,0,0,0
17,Magnolia,3085,or smelt like a softener yeah,0,0,0,0,0,0,0,0,0,0
17,Rosewood,3086,is it kinda like vaporub,1,0,0,0,0,0,0,0,0,0
17,Rosewood,3087,like that vixy kinda smell,1,0,0,0,0,0,0,0,0,0
17,Rosewood,3088,yeah from memory,0,0,0,0,0,0,0,0,0,0
17,Leather,3089,it smells herbal,1,0,0,0,0,0,0,0,0,0
17,Leather,3090,yeah thats pretty much all i have to say about this one,0,0,0,0,0,0,0,0,0,0
17,Orange Blossom,3091,it kinda smells like fresh,0,0,0,0,0,1,0,0,0,0
17,Orange Blossom,3092,like a little bit citrusy,1,0,0,0,0,0,0,0,0,0
17,Orange Blossom,3093,i dont really know how to describe this one but yeah,0,0,0,0,0,0,0,0,0,0
17,Guaiacol,3094,it smells like something from my fridge,1,0,0,0,0,0,0,0,0,0
17,Guaiacol,3095,but its not off,0,0,0,0,0,1,0,0,0,0
17,Guaiacol,3096,yeah,0,0,0,0,0,0,0,0,0,0
17,White Musk,3097,it kinda smells like asian medicine as well,1,0,0,0,0,0,0,0,0,0
17,White Musk,3098,umm kinda like those medicinal soups that my grandma would make yeah,1,0,0,0,0,0,0,0,0,0
17,Caraway Seed,3099,spicy,1,0,0,0,0,0,0,0,0,0
17,Caraway Seed,3100,umm yeah thats all i pretty much have to say about that,0,0,0,0,0,0,0,0,0,0
17,Sea Minerals,3101,oh this also smells like a softener,1,0,0,0,0,0,0,0,0,0
17,Sea Minerals,3102,yeah it also smells like a softener ,1,0,0,0,0,0,0,0,0,0
17,Sea Minerals,3103,its more fresh,0,0,0,0,0,1,0,0,0,0
17,Sea Minerals,3104,kinda like the light and breezy stuff yep,1,0,0,0,0,0,0,0,0,0
17,Dark Oud,3105,this is pretty strong,0,0,0,1,0,0,0,0,0,0
17,Dark Oud,3106,it kinda smells like mens perfume or mens aftershave,2,0,0,0,0,0,0,0,0,0
17,Dark Oud,3107,thats maybe gone off and kinda like the alcohol content has affected its smell,2,0,0,0,0,0,0,0,0,0
17,Dark Oud,3108,so kinda smells like alcohol,1,0,0,0,0,0,0,0,0,0
17,Musk,3109,this smells like laundry detergent,1,0,0,0,0,0,0,0,0,0
17,Musk,3110,yeah thats all i pretty much have to say about this one,0,0,0,0,0,0,0,0,0,0
17,Patchouli,3111,it smells like a traditional asian medicine,1,0,0,0,0,0,0,0,0,0
17,Patchouli,3112,kinda like somehting like theyd use for you know guasha,1,0,0,0,0,0,0,0,0,0
17,Ambergris,3113,this kinda smells sweet,0,0,0,0,0,1,0,0,0,0
17,Ambergris,3114,like a less strong version of nail polish remover,1,0,0,0,1,0,0,0,0,0
17,Ambergris,3115,much more subtle than that,0,0,0,0,1,0,0,0,0,0
17,Ambergris,3116,yep,0,0,0,0,0,0,0,0,0,0
17,Chamomile,3117,this smells like something thats gone off from the fridge,1,0,0,0,0,0,0,0,0,0
17,Chamomile,3118,but not in a bad way,0,1,0,0,0,0,0,0,0,0
17,Chamomile,3119,yeah,0,0,0,0,0,0,0,0,0,0
17,Honeysuckle,3120,this smells like fresh laundry,1,0,0,0,0,0,0,0,0,0
17,Honeysuckle,3121,it smells like floral yep,1,0,0,0,0,0,0,0,0,0
17,White Tea,3122,hmm so this one,0,0,0,0,0,0,0,0,0,0
17,White Tea,3123,it kinda smells like lemongrass,1,0,0,0,0,0,0,0,0,0
17,White Tea,3124,and medicinal,1,0,0,0,0,0,0,0,0,0
17,White Tea,3125,thats all i have to say aout that ,0,0,0,0,0,0,0,0,0,0
17,Geosmin,3126,"this smells super earthy and grassy, kinda like wet grass",3,0,0,0,0,1,0,0,0,0
17,Labdanum,3127,not very strong,0,0,0,0,1,0,0,0,0,0
17,Labdanum,3128,medicinal,1,0,0,0,0,0,0,0,0,0
17,Labdanum,3129,yeah thats pretty much all i have to say,0,0,0,0,0,0,0,0,0,0
17,Green Fig,3130,this kinda smells like,0,0,0,0,0,0,0,0,0,0
17,Green Fig,3131,it smells like a garden of flowers,1,0,0,0,0,0,0,0,0,0
17,Green Fig,3132,i dont know what flowers,0,0,0,0,0,0,0,0,0,0
17,Green Fig,3133,kind of earthy but not as earthy as the one i said was earthy,1,0,0,0,0,0,0,0,0,0
17,Lilac,3134,this also smells like laundry detergent,1,0,0,0,0,0,0,0,0,0
17,Lilac,3135,its kinda fresh,0,0,0,0,0,1,0,0,0,0
17,Cardamom,3136,oh this kinda smells its kinda smells fishy,1,0,0,0,0,0,0,0,0,0
17,Cardamom,3137,but not like fresh fish at the market,1,0,0,0,0,0,0,0,0,0
17,Cardamom,3138,its kinda like dried fish,1,0,0,0,0,1,0,0,0,0
17,Cardamom,3139,but its much more pleasant than dried fish,0,1,0,0,0,0,0,0,0,0
17,Geranium,3140,kind of floral,1,0,0,0,0,0,0,0,0,0
17,Geranium,3141,yeah thats pretty much all i hvae to say about that,0,0,0,0,0,0,0,0,0,0
17,Vetiver,3142,ok so this ones not very strong,0,0,0,0,1,0,0,0,0,0
17,Vetiver,3143,it kindof smells sweet,0,0,0,0,0,1,0,0,0,0
17,Vetiver,3144,kinda like kinda floral yeah,1,0,0,0,0,0,0,0,0,0
17,Floral Ozone,3145,I dont really know how to describe this,0,0,0,0,0,0,0,0,0,0
17,Floral Ozone,3146,its different to eveything else,0,0,0,0,0,1,0,0,0,0
17,Floral Ozone,3147,am i allowed to skip? no? ok,0,0,0,0,0,0,0,0,0,0
17,Floral Ozone,3148,its a nice pleasant soft smell,0,1,0,0,0,1,0,0,0,0
17,Floral Ozone,3149,but i wouldn't use it in cooking,1,0,0,0,0,0,0,0,0,0
17,Grapefruit,3150,This one's pertty neutral,0,0,0,0,0,1,0,0,0,0
17,Grapefruit,3151,its not very strong,0,0,0,0,1,0,0,0,0,0
17,Grapefruit,3152,so its quite subtle,0,0,0,0,1,0,0,0,0,0
17,Grapefruit,3153,it kinda smells like the swimming pool but like very subtle,1,0,0,0,1,0,0,0,0,0
17,Wattle,3154,okay this ones stronger,0,0,0,1,0,0,0,0,0,0
17,Wattle,3155,it smells like a laundry detergent,1,0,0,0,0,0,0,0,0,0
17,Wattle,3156,its not sweet,0,0,0,0,0,1,0,0,0,0
17,Wattle,3157,it smells fresh,0,0,0,0,0,1,0,0,0,0
17,Wattle,3158,it kinda smells like those umm toilet sprays that are like linen sheets or something like that,2,0,0,0,0,0,0,0,0,0
17,Frankincense,3159,this ones more herbal,1,0,0,0,0,0,0,0,0,0
17,Frankincense,3160,and yeah its not very strong,0,0,0,0,1,0,0,0,0,0
17,Nutmeg,3161,"this kinda smells like the doctors office like the doctors waiting when youre waiting to go see a doctor, thats what it smells like",1,0,0,0,0,0,0,0,0,0
17,Nutmeg,3162,i feel like it smells like a lift as well,1,0,0,0,0,0,0,0,0,0
17,Nutmeg,3163,yeah thats pretty much it,0,0,0,0,0,0,0,0,0,0
17,Lavender,3164,this one is floral,1,0,0,0,0,0,0,0,0,0
17,Lavender,3165,also smells like laundry detergent,1,0,0,0,0,0,0,0,0,0
17,Lavender,3166,yeah,0,0,0,0,0,0,0,0,0,0
17,Cedar,3167,I dont know why but with this one it smells more round than the one i just smelt,0,0,0,0,0,1,0,0,0,0
17,Cedar,3168,i mean yeah it kinda just smells like herbal medicine,1,0,0,0,0,0,0,0,0,0
17,Cedar,3169,its pretty neutral,0,0,0,0,1,0,0,0,0,0
17,Cedar,3170,not very strong,0,0,0,0,1,0,0,0,0,0
17,Almond,3171,oh this one is very strong,0,0,0,1,0,0,0,0,0,0
17,Almond,3172,it smells like that disgusting medicine like taste,1,0,1,0,0,0,0,0,0,0
17,Almond,3173,its kinda like,0,0,0,0,0,0,0,0,0,0
17,Almond,3174,whats that,0,0,0,0,0,0,0,0,0,0
17,Almond,3175,kinda like from memory,0,0,0,0,0,0,1,0,0,0
17,Almond,3176,the strawberry flavoured I think panadol,2,0,0,0,0,0,0,0,0,0
17,Almond,3177,i think the one thats like 5-12 or 7-12 years and its got like the dragon or penguin on it or the penguin something like that,1,0,0,0,0,0,0,0,0,0
17,Civet,3178,This one is more subtle than the one before,0,0,0,0,1,0,0,0,0,0
17,Civet,3179,its nicer,0,1,0,0,0,0,0,0,0,0
17,Civet,3180,"if this was a perfume, id feel like this is something that 40yo ladies would wear",1,0,0,0,0,0,0,0,0,0
17,Ginger,3181,hmm this is pretty strong,0,0,0,1,0,0,0,0,0,0
17,Ginger,3182,it kinda smells like lemons,1,0,0,0,0,0,0,0,0,0
17,Ginger,3183,yeah its pretty much all i have to say,0,0,0,0,0,0,0,0,0,0
17,Clove,3184,hmm this also has the,0,0,0,0,0,0,0,0,0,0
17,Clove,3185,i feel like this also has the dried fish smell,1,0,0,0,0,0,0,0,0,0
17,Clove,3186,but not as strong,0,0,0,0,1,0,0,0,0,0
17,Clove,3187,and not as unpleasant,0,1,0,0,0,0,0,0,0,0
17,Clove,3188,it kinda smell slike whats it called umm,0,0,0,0,0,0,0,0,0,0
17,Clove,3189,it kinda smells like goji berries yeah,1,0,0,0,0,0,0,0,0,0
17,Lily of the Valley,3190,hm mthis is a pretty strong smell,0,0,0,1,0,0,0,0,0,0
17,Lily of the Valley,3191,id say its floral,1,0,0,0,0,0,0,0,0,0
17,Lily of the Valley,3192,but it also smells like laundry detergent,1,0,0,0,0,0,0,0,0,0
17,Mint,3193,hm this is a pretty strong smell,0,0,0,1,0,0,0,0,0,0
17,Mint,3194,its kinda like when you've got a mint in your mouth and i dont know,1,0,0,0,0,0,0,0,0,0
17,Mint,3195,it kinda,0,0,0,0,0,0,0,0,0,0
17,Mint,3196,yeah it smells minty,1,0,0,0,0,0,0,0,0,0
17,Mint,3197,but its like,0,0,0,0,0,0,0,0,0,0
17,Mint,3198,when your mouth feels cold,0,0,0,0,0,0,0,0,1,0
17,Mint,3199,im getting that kinda feel,0,0,0,0,0,0,0,0,0,0
17,Mint,3200,yeah thats all i have to say,0,0,0,0,0,0,0,0,0,0
17,Cedramber,3201,hmm this smells like a,0,0,0,0,0,0,0,0,0,0
17,Cedramber,3202,this definitely smells like a womens perfume,1,0,0,0,0,0,0,0,0,0
17,Cedramber,3203,something that like 25 to like mid 30s would wear,1,0,0,0,0,0,0,0,0,0
17,Cedramber,3204,its not very strong,0,0,0,0,1,0,0,0,0,0
17,Sweet Vanilla,3205,hmm this is sweet,0,0,0,0,0,1,0,0,0,0
17,Sweet Vanilla,3206,its definitely sweet,0,0,0,0,0,1,0,0,0,0
17,Sweet Vanilla,3207,kinda like a vanillary kind of smell,1,0,0,0,0,0,0,0,0,0
17,Sweet Vanilla,3208,ubt its more than vanilla,1,0,0,0,0,0,0,0,0,0
17,Sweet Vanilla,3209,yep sometihng,0,0,0,0,0,0,0,0,0,0
17,Sweet Vanilla,3210,"its kinda smells like lush, yeah a lush store",2,0,0,0,0,0,0,0,0,0
18,Floral Ozone,3211,hmm interesting,0,0,0,0,0,0,0,0,1,0
18,Floral Ozone,3212,i dont know what this smells like,0,0,0,0,0,0,0,0,0,0
18,Floral Ozone,3213,kinda smells slightly medicinal but im not gonna use that word,1,0,0,0,0,0,0,0,0,0
18,Floral Ozone,3214,yeah medicinal,1,0,0,0,0,0,0,0,0,0
18,Floral Ozone,3215,theres a smell i know what it is but i cant find the word,0,0,0,0,0,0,1,0,0,0
18,Floral Ozone,3216,it kinda smells like cleaning agent slightly as well,1,0,0,0,0,0,0,0,0,0
18,Floral Ozone,3217,or maybe just because cleaning agent is fragranced as certain things and thats what im smelling,0,0,0,0,0,0,0,0,0,0
18,Floral Ozone,3218,i dont even know,0,0,0,0,0,0,0,0,0,0
18,Floral Ozone,3219,what does menthol smell like?,1,0,0,0,0,0,0,0,0,0
18,Floral Ozone,3220,it has that sharp smell to it,0,0,0,0,0,1,0,0,0,0
18,Floral Ozone,3221,okay im just gonna say herbal medicine,1,0,0,0,0,0,0,0,0,0
18,Guaiacol,3222,I dont like this one,0,0,1,0,0,0,0,0,0,0
18,Guaiacol,3223,its like im tasting it,0,0,0,0,0,0,0,0,1,0
18,Guaiacol,3224,this is one of those animals urines i bet you,1,0,0,0,0,0,0,0,0,0
18,Guaiacol,3225,its like possum urine,1,0,0,0,0,0,0,0,0,0
18,Guaiacol,3226,my vocabulary's not big enough for this,0,0,0,0,0,0,0,0,0,0
18,Guaiacol,3227,oh this ... ,0,0,0,0,0,0,0,0,0,0
18,Guaiacol,3228,i dont know,0,0,0,0,0,0,0,0,0,0
18,Guaiacol,3229,i thought if i closed it id come to a conclusion,0,0,0,0,0,0,0,0,0,0
18,Guaiacol,3230,i cant tell the difference between this one and the last one,1,0,0,0,0,0,0,0,0,0
18,Guaiacol,3231,i feel like im your outlier,0,0,0,0,0,0,0,0,0,0
18,Guaiacol,3232,im gonna say,0,0,0,0,0,0,0,0,0,0
18,Guaiacol,3233,can i say animal urine? possum urine,1,0,0,0,0,0,0,0,0,0
18,Orange Blossom,3234,oh orange,1,0,0,0,0,0,0,0,0,0
18,Orange Blossom,3235,citrus,1,0,0,0,0,0,0,0,0,0
18,Orange Blossom,3236,citrus,1,0,0,0,0,0,0,0,0,0
18,Orange Blossom,3237,wait what im getting confused,0,0,0,0,0,0,0,0,0,0
18,Orange Blossom,3238,i cant think of any words right now,0,0,0,0,0,0,0,0,0,0
18,Orange Blossom,3239,slightly pleasant,0,1,0,0,0,0,0,0,0,0
18,Nutmeg,3240,i used to think i had a really sensitive sense of smell but maybe i dont if i cant tell the difference,0,0,0,0,0,0,0,0,0,0
18,Nutmeg,3241,can i say medicine as opposed to herbal medicine,2,0,0,0,0,0,0,0,0,0
18,Nutmeg,3242,a more synthetic smell,0,0,0,0,0,0,0,0,0,1
18,White Musk,3243,oh smells nice,0,1,0,0,0,0,0,0,0,0
18,White Musk,3244,toilet air freshener,1,0,0,0,0,0,0,0,0,0
18,White Musk,3245,what fragrance is that,0,0,0,0,0,0,0,0,0,0
18,White Musk,3246,its like a rose or,1,0,0,0,0,0,0,0,0,0
18,White Musk,3247,i shouldnt rememebr what toilet air fershener,0,0,0,0,0,0,0,0,0,0
18,White Musk,3248,but its like that rose air freshener,2,0,0,0,0,0,0,0,0,0
18,White Musk,3249,which i guess is just rose,1,0,0,0,0,0,0,0,0,0
18,White Musk,3250,but whats the pink flower,0,0,0,0,0,0,0,0,0,0
18,White Musk,3251,thats the picture on the toilet,0,0,0,0,0,0,0,0,0,0
18,White Musk,3252,pink flower,1,0,0,0,0,0,0,0,0,0
18,White Musk,3253,whatever the pink flower is,1,0,0,0,0,0,0,0,0,0
18,White Musk,3254,but hey i associate pink with that scent,0,0,0,0,0,0,0,0,0,0
18,Cedar,3255,smells like a black candy,1,0,0,0,0,0,0,0,0,0
18,Cedar,3256,i dont wanna say liqourice because its not a liqourice scent,1,0,0,0,0,0,0,0,0,0
18,Cedar,3257,but you know those black candies that are brethren of liqourice,1,0,0,0,0,0,0,0,0,0
18,Cedar,3258,actually im just gonna go with candy but i wanna say non-sweet candy,2,0,0,0,0,1,0,0,0,0
18,Ginger,3259,orange liqourice,1,0,0,0,0,0,0,0,0,0
18,Ginger,3260,orange candy,1,0,0,0,0,0,0,0,0,0
18,Ginger,3261,can i taste it,0,0,0,0,0,0,0,0,0,0
18,Ginger,3262,oh i can describe this as anytihng right,0,0,0,0,0,0,0,0,0,0
18,Ginger,3263,like a rainy spring day,1,0,0,0,0,1,0,0,0,0
18,Leather,3264,this smells like dusk like the store,1,0,0,0,0,0,0,0,0,0
18,Leather,3265,combination of fragrance,1,0,0,0,0,0,0,0,0,0
18,Leather,3266,this msells like something i ate recently,1,0,0,0,0,0,0,0,0,0
18,Leather,3267,what did i eat recently,0,0,0,0,0,0,0,0,0,0
18,Leather,3268,it smells so much like something ive eaten,1,0,0,0,0,0,0,0,0,0
18,Leather,3269,what did i eat,0,0,0,0,0,0,0,0,0,0
18,Leather,3270,i wanna say it because it smells exactly like that,0,0,0,0,0,0,0,0,0,0
18,Leather,3271,its something ive eaten,1,0,0,0,0,0,0,0,0,0
18,Leather,3272,got a lot of thoughts in my mind so its a bit hard to push them out,0,0,0,0,0,0,0,0,0,0
18,Leather,3273,yeahsomething that has a chewy texture but not really,1,0,0,0,0,0,0,0,0,0
18,Leather,3274,"its kinda like a bread but those non-airy bread, dense bread",3,0,0,0,0,2,0,0,0,0
18,Leather,3275,yeah no idea,0,0,0,0,0,0,0,0,0,0
18,Leather,3276,sweet berad is all im gonna say,1,0,0,0,0,1,0,0,0,0
18,Sweet Vanilla,3277,hmm caramel,1,0,0,0,0,0,0,0,0,0
18,Sweet Vanilla,3278,caramel,1,0,0,0,0,0,0,0,0,0
18,Lilac,3279,cleaning agent,1,0,0,0,0,0,0,0,0,0
18,Lilac,3280,im not gonna be more specific,0,0,0,0,0,0,0,0,0,0
18,Patchouli,3281,yeah i dont like it,0,0,1,0,0,0,0,0,0,0
18,Patchouli,3282,i just wanna close it because i think ill finalise my thoughts,0,0,0,0,0,0,0,0,0,0
18,Patchouli,3283,i was gonna say somehting but it doesnt smell like what i was gonna say,0,0,0,0,0,0,0,0,0,0
18,Patchouli,3284,earthy,1,0,0,0,0,0,0,0,0,0
18,Patchouli,3285,like tree soil,1,0,0,0,0,0,0,0,0,0
18,Patchouli,3286,"tree soil, soil, not soil, earthy",3,0,0,0,0,0,0,0,0,0
18,Patchouli,3287,im gonna stick with earthy,1,0,0,0,0,0,0,0,0,0
18,Almond,3288,i actually htink my vocabulary's broken down because i know all these scents then i dont know the words,0,0,0,0,0,0,0,0,0,0
18,Almond,3289,what scent is this,0,0,0,0,0,0,0,0,0,0
18,Almond,3290,see i know it because ive smelt it before,0,0,0,0,0,0,1,0,0,0
18,Almond,3291,like a orangey smell,1,0,0,0,0,0,0,0,0,0
18,Almond,3292,but its not an orange,0,0,0,0,0,0,0,0,0,0
18,Almond,3293,its like,0,0,0,0,0,0,0,0,0,0
18,Almond,3294,i havent formed a thought,0,0,0,0,0,0,0,0,0,0
18,Almond,3295,you know what im thinking,0,0,0,0,0,0,0,0,0,0
18,Almond,3296,i went to the doctor office,0,0,0,0,0,0,0,0,0,0
18,Almond,3297,and the doctor was wearing some sort of perfume,0,0,0,0,0,0,0,0,0,0
18,Almond,3298,and it was like the sterile smell and the perfume smell mixed tgoether,2,0,0,0,0,0,0,0,0,0
18,Almond,3299,im gonna say let me have one more smell,0,0,0,0,0,0,0,0,0,0
18,Almond,3300,cough syrup,1,0,0,0,0,0,0,0,0,0
18,Civet,3301,sporty colognes,1,0,0,0,0,1,0,0,0,0
18,Cardamom,3302,thats a really bad one,0,0,1,0,0,0,0,0,0,0
18,Cardamom,3303,smells like asshole,1,0,0,0,0,0,0,0,0,0
18,Cardamom,3304,"oh wait i know how to, its dried fish is what it smells like, i smelt it in sri lanka",1,0,0,0,0,0,1,0,0,0
18,Cardamom,3305,or skunks piss or whatever,1,0,0,0,0,0,0,0,0,0
18,Cardamom,3306,it actually smells exactly like dried fish,1,0,0,0,0,0,1,0,0,0
18,Cardamom,3307,like the ones that hang out in the sun in sri lanka,1,0,0,0,0,0,0,0,0,0
18,Cardamom,3308,it was,0,0,0,0,0,0,0,0,0,0
18,Lavender,3309,it smells like a spicy nothing,1,0,0,0,0,1,0,0,0,0
18,Lavender,3310,you know what i mean,0,0,0,0,0,0,0,0,0,0
18,Lavender,3311,emptiness is what it smells like,0,0,0,0,0,1,0,0,0,0
18,Clove,3312,this one smells like dried fish again,1,0,0,0,0,1,0,0,0,0
18,Clove,3313,dried fish,1,0,0,0,0,1,0,0,0,0
18,Clove,3314,i bet you theres some sort of chemical thats released when the fish is being oxidised,1,0,0,0,0,0,0,0,0,0
18,Clove,3315,and thats what makes it smell like,0,0,0,0,0,0,0,0,0,0
18,Lily of the Valley,3316,clean,0,0,0,0,0,1,0,0,0,0
18,Frankincense,3317,lemon,1,0,0,0,0,0,0,0,0,0
18,Frankincense,3318,its actually some other kind of lemon,1,0,0,0,0,0,0,0,0,0
18,Frankincense,3319,because its not exactly lemon but im gonna say lemon,1,0,0,0,0,0,0,0,0,0
18,Green Fig,3320,mango,1,0,0,0,0,0,0,0,0,0
18,Green Fig,3321,smells like mango,1,0,0,0,0,0,0,0,0,0
18,Green Fig,3322,giving me the fruity boys now,1,0,0,0,0,0,0,0,0,0
18,Vetiver,3323,i think im gonna gag,0,0,1,0,0,0,0,0,1,0
18,Vetiver,3324,its so pungent,0,0,0,1,0,0,0,0,0,0
18,Vetiver,3325,dangerous,0,0,0,0,0,1,0,0,0,0
